{
  "$schema": "https://json-schema.org/draft/2020-12/schema",
  "$id": "drama-studio/task/v0",
  "title": "一次范围明确的任务",
  "type": "object",
  "additionalProperties": false,
  "required": [
    "schemaVersion",
    "taskId",
    "kind",
    "workstation",
    "project",
    "goal",
    "nonGoals",
    "readScope",
    "writeScope",
    "authorization",
    "revisionBudget",
    "status"
  ],
  "properties": {
    "schemaVersion": {
      "const": "drama-studio/task/v0"
    },
    "taskId": {
      "type": "string",
      "minLength": 1
    },
    "kind": {
      "type": "string",
      "enum": [
        "research",
        "topic",
        "planning",
        "outline",
        "draft",
        "review",
        "revision",
        "delivery"
      ]
    },
    "workstation": {
      "type": [
        "string",
        "null"
      ],
      "enum": [
        "C1",
        "C2",
        "C3",
        "C4",
        "C5",
        "C6",
        null
      ]
    },
    "project": {
      "type": "object",
      "additionalProperties": false,
      "required": [
        "localId",
        "remoteProjectId"
      ],
      "properties": {
        "localId": {
          "type": "string",
          "minLength": 1
        },
        "remoteProjectId": {
          "type": [
            "string",
            "null"
          ]
        }
      }
    },
    "goal": {
      "type": "string",
      "minLength": 1
    },
    "nonGoals": {
      "type": "array",
      "items": {
        "type": "string",
        "minLength": 1
      }
    },
    "readScope": {
      "type": "array",
      "items": {
        "$ref": "#/$defs/ref"
      }
    },
    "writeScope": {
      "type": "array",
      "items": {
        "$ref": "#/$defs/ref"
      }
    },
    "authorization": {
      "type": "object",
      "additionalProperties": false,
      "required": [
        "source",
        "scope"
      ],
      "properties": {
        "source": {
          "type": "string",
          "enum": [
            "user_message",
            "studio_setting",
            "none"
          ]
        },
        "scope": {
          "type": "string"
        },
        "evidence": {
          "type": "string"
        }
      }
    },
    "revisionBudget": {
      "type": "integer",
      "minimum": 0,
      "maximum": 10
    },
    "status": {
      "type": "object",
      "additionalProperties": false,
      "required": [
        "run",
        "goal",
        "adoption"
      ],
      "properties": {
        "run": {
          "type": "string",
          "enum": [
            "planned",
            "running",
            "interrupted",
            "finished",
            "failed"
          ]
        },
        "goal": {
          "type": "string",
          "enum": [
            "not_assessed",
            "met",
            "partially_met",
            "not_met",
            "insufficient_evidence"
          ]
        },
        "adoption": {
          "type": "string",
          "enum": [
            "none",
            "pending_user",
            "adopted_remote",
            "rejected"
          ]
        }
      }
    },
    "adoptionEvidence": {
      "$ref": "#/$defs/ref"
    },
    "unknowns": {
      "type": "array",
      "items": {
        "type": "string",
        "minLength": 1
      },
      "description": "Honest unknowns that no other field can express"
    },
    "layer": {
      "type": "string",
      "enum": [
        "C3a",
        "C3b",
        "C3c",
        "C4",
        "C5a",
        "C5b",
        "C6"
      ],
      "description": "Optional: D6 layer; revisionBudget is read per layer (C3a counts implementation swaps, C5a counts dialogue-plan revisions); C5a/C5b/C6 tasks must cite dialogueTarget"
    },
    "constraints": {
      "type": "array",
      "items": {
        "type": "object",
        "additionalProperties": false,
        "required": [
          "text",
          "origin"
        ],
        "properties": {
          "text": {
            "type": "string",
            "minLength": 1
          },
          "origin": {
            "type": "string",
            "enum": [
              "skill",
              "target",
              "writer",
              "orchestrator",
              "user"
            ]
          },
          "cite": {
            "type": [
              "string",
              "null"
            ],
            "description": "orchestrator constraints must cite a target clause"
          }
        }
      },
      "description": "Optional: task constraints with their origin; any hit on data/constraint-blocklist.json is rejected whatever the origin"
    },
    "dialogueTarget": {
      "type": "object",
      "additionalProperties": false,
      "required": [
        "targetId",
        "revision"
      ],
      "properties": {
        "targetId": {
          "type": "string",
          "minLength": 1
        },
        "revision": {
          "type": "string",
          "minLength": 1
        }
      },
      "description": "Optional: the dialogue-target targetId@revision this task follows"
    },
    "target": {
      "type": "object",
      "additionalProperties": false,
      "required": [
        "kind"
      ],
      "properties": {
        "kind": {
          "type": "string",
          "enum": [
            "episode_text",
            "episode_plan",
            "function_map",
            "ledger",
            "season_plan"
          ]
        },
        "episode": {
          "type": [
            "string",
            "integer"
          ]
        }
      },
      "description": "Optional (D6-2): what a C6 task reviews; an outline-side read (episode_plan, function_map, ledger, season_plan) needs no dialogueTarget"
    }
  },
  "$defs": {
    "ref": {
      "type": "object",
      "additionalProperties": false,
      "required": [
        "kind",
        "id",
        "revision"
      ],
      "properties": {
        "kind": {
          "type": "string",
          "enum": [
            "remote_artifact",
            "remote_page",
            "remote_snapshot",
            "remote_brief",
            "local_file",
            "knowledge_card",
            "context_snapshot",
            "remote_receipt"
          ]
        },
        "id": {
          "type": "string",
          "minLength": 1
        },
        "revision": {
          "type": [
            "integer",
            "string",
            "null"
          ]
        },
        "sha256": {
          "type": "string",
          "pattern": "^sha256:[a-f0-9]{64}$"
        },
        "range": {
          "type": "object",
          "additionalProperties": false,
          "required": [
            "start",
            "end"
          ],
          "properties": {
            "start": {
              "type": "integer",
              "minimum": 0
            },
            "end": {
              "type": "integer",
              "minimum": 0
            }
          }
        }
      }
    }
  }
}
